,,extensionName,extensionDescription,contextMenuItemLabel
en,English,Close Other Tabs,"Allows you to close other tabs with a button on the toolbar, an entry on the right-click menu or with the Alt+Shift+W keyboard shortcut.",Close Other Tabs
ar,Arabic,إغلاق علامات التبويب الأخرى,يسمح لك لإغلاق علامات التبويب الأخرى مع زر على شريط الأدوات، دخول على القائمة النقر بزر الماوس الأيمن أو مع البديل + شيفت + اختصار لوحة المفاتيح W.,إغلاق علامات التبويب الأخرى
am,Amharic,ሌሎች ትሮችን ዝጋ,"እርስዎ, በመሳሪያ አሞሌ ላይ አዝራር ጋር በቀኝ-ጠቅ ምናሌ ላይ ወይም Alt + Shift + W የቁልፍ ሰሌዳ አቋራጭ ጋር አንድ ግቤት ሌሎች ትሮችን ዝጋ ይፈቅድለታል.",ሌሎች ትሮችን ዝጋ
bg,Bulgarian,Затваряне на другите раздели,"Позволява ви да затворите другите раздели с един бутон в лентата с инструменти, за влизане на десния бутон на мишката или с Alt + Shift + W клавишната комбинация.",Затваряне на другите раздели
bn,Bengali,অন্যান্য ট্যাব বন্ধ করুন,"আপনি টুলবারে, ডান-ক্লিক মেনু বা অল্টার + শিফট + W কীবোর্ড শর্টকাট সহ একটি এন্ট্রি একটি বাটন সঙ্গে অন্যান্য ট্যাব বন্ধ করার অনুমতি দেয়।",অন্যান্য ট্যাব বন্ধ করুন
ca,Catalan,Tancar les altres pestanyes,"Permet tancar altres pestanyes amb un botó a la barra d'eines, una entrada al menú de el botó dret o amb el Alt + Shift + tecla d'accés W.",Tancar les altres pestanyes
cs,Czech,Zavřít ostatní karty,"Umožňuje zavření ostatních karet pomocí tlačítka na panelu nástrojů, položky v menu pravého tlačítka myši, nebo pomocí Alt + Shift + W klávesovou zkratku.",Zavřít ostatní karty
da,Danish,Luk andre faner,"Gør det muligt at lukke andre faner med en knap på værktøjslinjen, en post på højre klik menu eller med Alt + Shift + W tastaturgenvej.",Luk andre faner
de,German,Andere Tabs schließen,"Können Sie andere Registerkarten mit einer Schaltfläche in der Symbolleiste, einen Eintrag auf dem Rechtsklick-Menü oder mit der Alt + Umschalt + W Tastenkombination schließen.",Andere Tabs schließen
el,Greek,Κλείσιμο των άλλων καρτελών,"Σας επιτρέπει να κλείσετε άλλες καρτέλες με ένα κουμπί στη γραμμή εργαλείων, μια καταχώρηση στο μενού του δεξιού κλικ ή με το Alt Shift + W συντόμευση πληκτρολογίου +.",Κλείσιμο των άλλων καρτελών
en_GB,English (Great Britain),Close Other Tabs,"Allows you to close other tabs with a button on the toolbar, an entry on the right-click menu or with the Alt+Shift+W keyboard shortcut.",Close Other Tabs
en_US,English (USA),Close Other Tabs,"Allows you to close other tabs with a button on the toolbar, an entry on the right-click menu or with the Alt+Shift+W keyboard shortcut.",Close Other Tabs
es,Spanish,Cerrar las otras pestañas,"Permite cerrar otras pestañas con un botón en la barra de herramientas, una entrada en el menú del botón derecho o con el Alt + Shift + tecla de acceso W.",Cerrar las otras pestañas
es_419,Spanish (Latin America and Caribbean),Cerrar las otras pestañas,"Permite cerrar otras pestañas con un botón en la barra de herramientas, una entrada en el menú del botón derecho o con el Alt + Shift + tecla de acceso W.",Cerrar las otras pestañas
et,Estonian,Sule muud vahelehed,Võimaldab Sule muud vahelehed nupuga tööriistaribal kande paremklõpsu menüü või Alt + Shift + W kiirklahvi.,Sule muud vahelehed
fa,Persian,بستن برگه های دیگر,اجازه می دهد تا شما را به بستن برگه های دیگر با یک دکمه در نوار ابزار، یک ورودی در منوی راست کلیک و یا با ALT + SHIFT + میانبر صفحه کلید W.,بستن برگه های دیگر
fi,Finnish,Sulje muut välilehdet,"Voit sulkea muut välilehdet kanssa -painiketta työkalurivillä, merkintä oikealla hiirennapilla tai Alt + Shift + W pikanäppäin.",Sulje muut välilehdet
fil,Filipino,Isara ang Ibang Mga Tab,"Binibigyang-daan kang isara ang iba pang mga tab na may isang pindutan sa toolbar, isang entry sa menu ng right-click o sa Alt + Shift + W keyboard shortcut.",Isara ang Ibang Mga Tab
fr,French,Fermer les autres onglets,"Permet de fermer les autres onglets avec un bouton de la barre d'outils, une entrée dans le menu contextuel ou avec les touches Alt + Maj + W raccourci clavier.",Fermer les autres onglets
gu,Gujarati,અન્ય ટૅબ્સને બંધ કરો,"તમે ટૂલબાર પર, રાઇટ-ક્લિક મેનુમાં પર અથવા Alt + Shift + W કીબોર્ડ શોર્ટકટ સાથે એન્ટ્રીમાં એક બટન સાથે અન્ય ટૅબ્સને બંધ કરવાની મંજૂરી આપે છે.",અન્ય ટૅબ્સને બંધ કરો
he,Hebrew,סגור כרטיסיות אחרות,"מאפשר לך לסגור כרטיסיות אחרות עם כפתור בסרגל הכלים, ערך בתפריט הקליק הימני או עם קיצור המקשים Alt + Shift + W.",סגור כרטיסיות אחרות
hi,Hindi,अन्य टैब बंद करें,"आप उपकरण पट्टी पर, राइट-क्लिक मेनू पर या Alt + Shift + डब्ल्यू कीबोर्ड शॉर्टकट के साथ एक प्रवेश के लिए एक बटन के साथ अन्य टैब बंद करने देता है।",अन्य टैब बंद करें
hr,Croatian,Zatvori ostale kartice,"Omogućuje vam da zatvorite druge kartice s gumba na alatnoj traci, unos u izborniku desnog klika ili s ALT + W tipkovni prečac.",Zatvori ostale kartice
hu,Hungarian,Egyéb lapok bezárása,"Lehetővé teszi, hogy lezárja más lapokat egy gombra az eszköztáron, egy bejegyzést a jobb egérgombbal a menü, vagy az Alt + Shift + W billentyűkombinációt.",Egyéb lapok bezárása
id,Indonesian,Tutup Tab Lain,"Memungkinkan Anda untuk menutup tab lainnya dengan tombol pada toolbar, sebuah entri di menu klik kanan atau dengan Alt + Shift + pintas keyboard W.",Tutup Tab Lain
it,Italian,Chiudi le altre schede,"Consente di chiudere altre schede con un pulsante sulla barra degli strumenti, una voce nel menu di scelta rapida o con i tasti Alt + Maiusc + W scorciatoia da tastiera.",Chiudi le altre schede
ja,Japanese,他のタブをすべて閉じます,あなたは、ツールバーのボタンを右クリックメニューのか、Alt + Shiftキー+ Wキーボードショートカットを持つエントリを他のタブを閉じることができます。,他のタブをすべて閉じます
kn,Kannada,ಇತರ ಟ್ಯಾಬ್ಗಳನ್ನು ಮುಚ್ಚಿ,"ಟೂಲ್ಬಾರ್ನಲ್ಲಿ, ಬಲ ಕ್ಲಿಕ್ ಮೆನು ಅಥವಾ Alt + Shift + W ಕೀಬೋರ್ಡ್ ಶಾರ್ಟ್ಕಟ್ ಒಂದು ಪ್ರವೇಶ ಒಂದು ಬಟನ್ ನೀವು ಇತರ ಟ್ಯಾಬ್ಗಳನ್ನು ಮುಚ್ಚಿ ಅನುಮತಿಸುತ್ತದೆ.",ಇತರ ಟ್ಯಾಬ್ಗಳನ್ನು ಮುಚ್ಚಿ
ko,Korean,다른 탭 닫기,당신이 도구 모음에 버튼을 오른쪽 클릭 메뉴에서 또는 Alt + Shift + W 키보드 바로 가기 항목을 다른 탭을 닫을 수 있습니다.,다른 탭 닫기
lt,Lithuanian,Uždaryti kitus skirtukus,"Leidžia Uždaryti kitus skirtukus su vienu mygtuko įrankių juostoje, įrašą apie dešiniuoju pelės klavišu meniu arba su Alt + Shift + W klaviatūrą.",Uždaryti kitus skirtukus
lv,Latvian,Aizvērt citas cilnes,"Ļauj aizvērt citas cilnes ar pogu rīkjoslā, ierakstu par labo klikšķi izvēlnē vai ar Alt + Shift + W tastatūras īsceļu.",Aizvērt citas cilnes
ml,Malayalam,മറ്റ് ടാബുകൾ അടയ്ക്കുക,"ഉപകരണബാറിന്റെ ഒരു ബട്ടൺ, വലത്-ക്ലിക്ക് മെനു അല്ലെങ്കിൽ + Shift + W കീബോർഡ് കുറുക്കുവഴി ഒരു എൻട്രി മറ്റ് ടാബുകൾ അടയ്ക്കുക അനുവദിക്കുന്നു.",മറ്റ് ടാബുകൾ അടയ്ക്കുക
mr,Marathi,अन्य टॅब बंद करा,"आपण टूलबारवर एक बटण इतर टॅब बंद, राईट-क्लिक मेनू किंवा Alt + Shift + प कीबोर्ड शॉर्टकट एक नोंद अनुमती देते.",अन्य टॅब बंद करा
ms,Malay,Tutup Tab Lain,"Membolehkan anda untuk menutup tab lain dengan butang pada bar alat, entri pada menu klik kanan atau dengan Alt + Shift + pintasan papan kekunci W.",Tutup Tab Lain
nl,Dutch,Andere tabbladen sluiten,"Hiermee kunt u andere tabbladen te sluiten met een knop op de werkbalk, een vermelding op de klik met de rechtermuisknop menu of met Alt + Shift + W sneltoets.",Andere tabbladen sluiten
no,Norwegian,Lukk andre faner,"Kan du lukke andre faner med en knapp på verktøylinjen, en oppføring på høyreklikkmenyen eller med Alt + Shift + W hurtigtast.",Lukk andre faner
pl,Polish,Zamknij inne karty,"Pozwala zamknąć inne karty z przyciskiem na pasku narzędzi, wpis w menu prawego przycisku myszy lub za pomocą Alt + Shift + W skrótu klawiaturowego.",Zamknij inne karty
pt_BR,Portuguese (Brazil),Fechar outras guias,"Permite fechar outras guias com um botão na barra de ferramentas, uma entrada no menu do botão direito ou com o Alt + Shift + atalho de teclado W.",Fechar outras guias
pt_PT,Portuguese (Portugal),Fechar outras guias,"Permite fechar outras guias com um botão na barra de ferramentas, uma entrada no menu do botão direito ou com o Alt + Shift + atalho de teclado W.",Fechar outras guias
ro,Romanian,Închideți celelalte file,"Vă permite să închideți alte file cu un buton de pe bara de instrumente, o intrare din meniul clic-dreapta sau cu Alt + Shift + W rapidă de la tastatură.",Închideți celelalte file
ru,Russian,Закрыть другие вкладки,"Позволяет закрыть другие вкладки с помощью кнопки на панели инструментов, запись в меню правой кнопки мыши или с помощью Alt + Shift + W клавиш.",Закрыть другие вкладки
sk,Slovak,Zatvoriť ostatné karty,"Umožňuje zatvorenie ostatných kariet pomocou tlačidla na paneli nástrojov, položky v menu pravého tlačidla myši, alebo pomocou Alt + Shift + W klávesovú skratku.",Zatvoriť ostatné karty
sl,Slovenian,Zapri druge zavihke,"Vam omogoča, da zaprete druge zavihke z gumbom na orodni vrstici, vnos v meniju desno tipko miške kliknite ali z + Shift + W bližnjico na tipkovnici Alt.",Zapri druge zavihke
sr,Serbian,Затвори друге картице,"Омогућава вам да затворите друге картице са дугметом на траци са алаткама, унос у менију десног клика или са Алт + Схифт + В пречица са тастатуре.",Затвори друге картице
sv,Swedish,Stäng andra flikar,"Gör att du kan stänga andra flikar med en knapp i verktygsfältet, en post på högerklicksmenyn eller med Alt + Skift + W kortkommando.",Stäng andra flikar
sw,Swahili,Funga Vichupo Vingine,"Inakuwezesha karibu tabo nyingine na kifungo juu ya toolbar, kuingia kwenye menyu bofya kulia au na Alt + Shift + W keyboard njia ya mkato.",Funga Vichupo Vingine
ta,Tamil,பிற தாவல்களை மூடுக,நீங்கள் கருவிப்பட்டியில் ஒரு பொத்தானை பிற தாவல்களை மூட வலது கிளிக் மெனுவில் அல்லது Alt + Shift + A W அழுத்தினால் விசைப்பலகை குறுக்குவழி கூடிய உள்ளீடு அனுமதிக்கிறது.,பிற தாவல்களை மூடுக
te,Telugu,ఇతర టాబ్లను మూసివేయి,"మీరు ఇతర టాబ్లను కుడి క్లిక్ మెనులో లేదా Alt + Shift + W కీబోర్డ్ సత్వరమార్గం ఒక ప్రారంభ, టూల్బార్లో ఒక బటన్ తో మూసివేయడం అనుమతిస్తుంది.",ఇతర టాబ్లను మూసివేయి
th,Thai,ปิดแท็บอื่น ๆ,ช่วยให้คุณสามารถปิดแท็บอื่น ๆ ที่มีปุ่มบนแถบเครื่องมือรายการในเมนูคลิกขวาหรือกับ Alt + Shift + แป้นพิมพ์ลัด W,ปิดแท็บอื่น ๆ
tr,Turkish,Diğer Sekmeleri Kapat,Eğer araç çubuğunda bir düğme ile sağ tıklama menüsündeki veya Alt + Shift + W klavye kısayolu ile bir girdi diğer sekmeleri kapatmak için izin verir.,Diğer Sekmeleri Kapat
uk,Ukrainian,Закрити інші вкладки,"Дозволяє закрити інші вкладки за допомогою кнопки на панелі інструментів, запис в меню правої кнопки миші або за допомогою Alt + Shift + W клавіш.",Закрити інші вкладки
vi,Vietnamese,Close Other Tabs,"Cho phép bạn đóng các tab khác với một nút trên thanh công cụ, một mục trên menu chuột phải hoặc qua các nhân Alt + Shift + phím tắt W.",Close Other Tabs
zh_CN,Chinese (China),关闭其他标签页,允许您使用一个按钮工具栏上的关闭其他标签，其中键Alt + Shift + W键盘快捷键的右键菜单或条目。,关闭其他标签页
zh_TW,Chinese (Taiwan),關閉其他標籤頁,允許您使用一個按鈕工具欄上的關閉其他標籤，其中鍵Alt + Shift + W鍵盤快捷鍵的右鍵菜單或條目。,關閉其他標籤頁